[
    {
        "version": "4.3.9",
        "date": "2025-11-13",
        "type": "current",
        "changes": [
            "❤️ FAVORİLER: Grid, liste ve Hesabım favorilerinde nonce/AJAX süreçleri birleştirildi; tüm favorileri temizleme akışı güçlendirildi",
            "💬 BİLDİRİMLER: Tüm frontend shortcode'larında toast stili ve animasyonları standart hale getirildi",
            "🎨 ARAYÜZ: Grid/liste kart hizaları, mobil butonlar, takvim boşlukları ve Hesabım favori kartları iyileştirildi",
            "🚗 ARAÇ LİSTESİ: Yıl ve kilometre ikon eşleştirmeleri düzeltildi, varsayılan simge desteği eklendi",
            "🧰 VARSAYILAN VERİ: Yeni kurulumlarda araç detay/özellik/ekipman alanları otomatik dolduruluyor",
            "⚙️ QUICK EDIT: Durum/müsaitlik senkronizasyonu düzeltildi, eski Passive / In Progress etiketleri kaldırıldı",
            "📚 DÖKÜMANTASYON: docs/site altında admin rehberleri, başlangıç adımları ve test checklistleri güncellendi"
        ]
    },
    {
        "version": "4.3.8",
        "date": "2025-11-06",
        "type": "previous",
        "changes": [
            "🌍 MERKEZİ PARA BİRİMİ SİSTEMİ: Birleşik para birimi sembol yönetimi için CurrencyHelper sınıfı oluşturuldu (47 para birimi)",
            "🌐 MERKEZİ DİL SİSTEMİ: Birleşik locale/dil yönetimi için LanguageHelper sınıfı oluşturuldu (60+ dil)",
            "🔧 PARA BİRİMİ TUTARLILIĞI: 14+ dosyada tüm hardcode para birimi sembol listeleri CurrencyHelper ile değiştirildi",
            "🌍 DİL TUTARLILIĞI: Eklenti dosyalarında tüm hardcode locale eşlemeleri LanguageHelper ile değiştirildi",
            "📊 AYAR BİRLEŞTİRME: Settings.php, SettingsCore.php, PayPalSettings.php artık merkezi para birimi listelerini kullanıyor",
            "⚙️ MERKEZİ YÖNETİM: Para birimi ve dil tanımları tek kaynaktan yönetiliyor (CurrencyHelper, LanguageHelper)",
            "🔗 FİLTRE HOOK'LARI: Şablon uyumluluğu için CurrencyHelper filter hook kaydedildi",
            "📱 KÜRESEL HAZIRLIK: Eklenti artık tutarlı para birimi ve dil desteği ile küresel pazarlara tam hazır",
            "✅ KOD KALİTESİ: Birden fazla dosyada tekrarlanan para birimi/dil tanımları kaldırıldı",
            "🎯 BAKIM KOLAYLIĞI: Para birimleri ve diller için tek gerçek kaynak - genişletmesi kolay",
            "💬 MESAJLAŞMA SİSTEMİ YENİDEN YAPILANDIRMA: Merkezi mesaj URL yönetimi için MessageUrlHelper sınıfı oluşturuldu",
            "🔗 MESAJ URL'LERİ: Mesajlaşma sistemindeki tüm hardcode admin URL'leri dinamik MessageUrlHelper çağrıları ile değiştirildi",
            "🐛 MESAJ ÖNBELLEK DÜZELTMESİ: MessageCache::clear_message_cache() artık TypeError'ı önlemek için int|string|null kabul ediyor",
            "📝 MESAJ İÇERİK DÜZELTMESİ: get_thread_messages() artık WP_Query kullanıyor ve post_content'in her zaman yüklendiğini garanti ediyor",
            "🔄 THREAD GÖRÜNTÜLEME DÜZELTMESİ: render_message_thread() fallback mantığı ve çoklu içerik yükleme yöntemleri ile geliştirildi",
            "🔧 YANIT İŞLEVSELLİĞİ: SendReply.php doğru thread_id işleme için düzeltildi (UUID string desteği)",
            "📋 TOPLU İŞLEM DÜZELTMESİ: handle_bulk_actions() çıktıdan önce taşınarak 'Headers already sent' hatası düzeltildi",
            "🌐 MESAJ i18n: Mesajlaşma sistemi dosyalarındaki tüm Türkçe yorumlar İngilizce'ye çevrildi",
            "✅ MESAJ URL'LERİ: Mesaj listesi, görüntüleme, yanıt, düzenleme ve ayar URL'leri artık merkezi MessageUrlHelper kullanıyor",
            "🔗 FRONTEND ENTEGRASYONU: Frontend mesaj URL'leri artık dinamik oluşturma için AccountController::get_account_url() kullanıyor"
        ]
    },
    {
        "version": "4.3.7",
        "date": "2025-10-30",
        "type": "previous",
        "changes": [
            "🌐 REST API ENTEGRASYONU: Integration Settings sekmesine eksiksiz REST API ayarları entegrasyonu",
            "🔑 API ANAHTARLARI YÖNETİMİ: Oluşturma, listeleme, iptal etme ve silme işlevselliği ile eksiksiz API anahtarı yönetim sistemi",
            "📋 MEVCUT ENDPOINT'LER: Namespace ve method bilgisi ile gerçek zamanlı REST API endpoint'leri listesi",
            "🔄 VARSayıLANLARA SIFIRLA: Tüm ayar sekmelerine varsayılanlara sıfırla butonu eklendi (General, Booking, Payment, Email, vb.)",
            "🔒 REST API GÜVENLİĞİ: Rate limiting, token yönetimi, HTTPS zorunluluğu, IP whitelist/blacklist ayarları",
            "⚙️ REST AYARLARI: Kapsamlı REST API yapılandırması (rate limitler, önbellek, geliştirme modu, güvenlik)",
            "🎨 UI/UX İYİLEŞTİRMELERİ: DatePicker başlığı flexbox düzeni ile yeniden tasarlandı",
            "📅 DATEPICKER STİLİ: Select-specific stiller kaldırıldı, başlık ortalaması iyileştirildi",
            "🔧 FORM ETİKET DÜZELTMESİ: İletişim Bilgileri etiketleri (Ad, Soyad, E-posta, Telefon) görünürlük sorunu düzeltildi",
            "✅ BUTON METNİ DÜZELTMESİ: Rezervasyon Yap butonu metni görünürlük ve doğrulama durumu düzeltildi",
            "👤 KULLANICI ADI OLUŞTURMA: Kullanıcı adı artık e-posta yerine ad/soyaddan oluşturuluyor",
            "🔐 MÜŞTERİ ROLÜ: WordPress Customer rol kayıt sistemi uygulandı",
            "🐛 REZERVASYON AYARLARI DÜZELTMESİ: İptal Son Tarihi (Saat) alanı kaydetme sorunu çözüldü",
            "🔧 SEKME SANİTİZASYONU: Sanitization mantığında Rezervasyon Yönetimi sekmesi tespiti düzeltildi",
            "📝 KULLANICI OLUŞTURMA: BookingForm, ManualBooking, AddCustomerPage'de kullanıcı oluşturma güncellendi",
            "🌍 i18n DESTEĞİ: Form etiketleri ve buton metinleri için fallback çevirileri eklendi",
            "✅ FORM DOĞRULAMA: Rezervasyon Yap butonu doğrulaması sadeleştirildi (Şartlar checkbox'ı ile kontrol ediliyor)",
            "🎯 KOD KALİTESİ: Sanitization ve benzersizlik kontrolleri ile kullanıcı adı oluşturma iyileştirildi",
            "📱 RESPONSIVE: Daha iyi mobil uyumluluk için tarih seçici başlığı geliştirildi"
        ]
    },
    {
        "version": "4.3.6",
        "date": "2025-10-23",
        "type": "previous",
        "changes": [
            "🎛️ AYAR BİRLEŞTİRME: Eksiksiz ayar mimarisi temizliği ve optimizasyonu",
            "🗑️ TEKRAR KALDIRMA: SettingsCore'dan 9 kullanılmayan register_* fonksiyonu kaldırıldı",
            "🔧 SAHTE BÖLÜM DÜZELTMESİ: Var olmayan email_notifications ve booking_payment bölümleri kaldırıldı",
            "✅ EKSİK BÖLÜMLER EKLENDİ: AddonSettings Rezervasyon sekmesine düzgün şekilde entegre edildi",
            "🎯 AYAR DENETİMİ: Tüm 23 kayıtlı bölüm doğrulandı ve düzgün şekilde render edildi",
            "📊 SİSTEM & PERFORMANS: 10+ ayar grubu birleştirildi ve optimize edildi",
            "🎛️ SEKME İZOLASYONU: Granüler sekme-spesifik sanitization çapraz sekme çakışmalarını önler",
            "🔒 CHECKBOX DÜZELTMESİ: Tüm ayar sekmelerinde checkbox kaydetme sorunları düzeltildi",
            "📧 E-POSTA SİSTEMİ QA: Kapsamlı e-posta ayarları ve bildirimleri doğrulaması",
            "🎨 E-POSTA ŞABLONLARI: Tüm 19 e-posta şablonu için modern responsive tasarım",
            "📝 ŞABLON GEÇERSİZ KILMALAR: Admin ayarlardan e-posta konularını ve içeriğini geçersiz kılabilir",
            "🌍 i18n GENİŞLETME: Küresel özelleştirme için 40+ frontend URL ve metin ayarları",
            "🗂️ ENTEGRASYON AYARLARI: Bilgilendirici placeholder ile geleceğe hazır sekme",
            "❌ RAPORLAR SEKMESİ KALDIRILDI: Tekrar ana Raporlar sayfasına birleştirildi",
            "💬 YORUM AYARLARI: Frontend & Display sekmesine düzgün şekilde entegre edildi",
            "⚡ PERFORMANS: 626+ satır ölü kod ve tekrarlanan fonksiyonlar kaldırıldı",
            "🧹 KOD TEMİZLİĞİ: Bakım kolaylığı için 14+ ayar dosyası birleştirildi",
            "✅ ÜRETİM HAZIR: Tüm ayarlar test edildi, doğrulandı ve tam işlevsel"
        ]
    },
    {
        "version": "4.3.5",
        "date": "2025-10-16",
        "type": "previous",
        "changes": [
            "🔧 ŞABLON YENİDEN YAPILANDIRMA: Tüm şablon dosyaları için eksiksiz WordPress Coding Standards uyumluluğu",
            "🛡️ GÜVENLİK İYİLEŞTİRMELERİ: Kapsamlı XSS, SQL Injection ve CSRF koruması uygulaması",
            "🌐 i18n UYUMLULUĞU: Uygun textdomain yükleme ile eksiksiz uluslararasılaştırma desteği",
            "📝 KOD STANDARTLARI: Tüm şablonlar artık WordPress Coding Standards (WPCS) takip ediyor",
            "🗂️ HESAP ŞABLONLARI: Güvenlik ve i18n uyumluluğu ile 9 hesap şablon dosyası yeniden yapılandırıldı",
            "📧 E-POSTA ŞABLONLARI: Uygun escaping ve dil özellikleri ile 4 e-posta şablonu geliştirildi",
            "💬 MESAJ ŞABLONLARI: Güvenlik ve i18n iyileştirmeleri ile 5 mesaj şablonu güncellendi",
            "🎯 SHORTCODE ŞABLONLARI: Kapsamlı güvenlik düzeltmeleri ile 14 shortcode şablonu yeniden yapılandırıldı",
            "📄 SAYFA ŞABLONLARI: Eksiksiz uyumluluk ile archive-vehicle.php ve single-vehicle.php güncellendi",
            "🧪 TEST ŞABLONLARI: Güvenlik ve i18n uyumluluğu ile test-shortcodes.php geliştirildi",
            "🔒 GÜVENLİK DÜZELTMELERİ: Nonce doğrulama, input sanitization ve output escaping eklendi",
            "🌍 KÜRESEL HAZIRLIK: Küresel uyumluluk için tüm Türkçe yorumlar İngilizce'ye çevrildi",
            "⚡ PERFORMANS: Şablon yükleme ve koşullu asset yönetimi optimize edildi",
            "📱 RESPONSIVE: Tüm şablon dosyalarında mobil uyumluluk geliştirildi",
            "✅ ÜRETİM HAZIR: Tüm şablonlar artık eksiksiz güvenlik uyumluluğu ile üretim hazır"
        ]
    },
    {
        "version": "4.3.4",
        "date": "2025-10-09",
        "type": "previous",
        "changes": [
            "📄 MAKBUZ YÜKLEME SİSTEMİ: Müşteriler için eksiksiz ödeme makbuzu yönetimi",
            "📧 E-POSTA BİLDİRİMLERİ: Makbuz onayı/reddi için HTML e-posta şablonları",
            "🎨 MODERN E-POSTA TASARIMI: Gradient başlıklı responsive HTML e-posta şablonları",
            "🔒 GÜVENLİK İYİLEŞTİRMELERİ: Tüm e-posta içeriği için kapsamlı sanitization ve escaping",
            "📱 MOBİL ÖNCELİKLİ E-POSTALAR: Tüm cihazlar için optimize edilmiş responsive e-posta şablonları",